{
  "$comment": "The Lantern Guild's sellswords (world doc §4 v1.11, GDD §6.2): what the player reads about ranks and perks. The ids are the sim's (src/sim/companions.js) and test/companions.test.mjs keeps them in step; the numbers in a line are the sim's numbers.",
  "ranks": {
    "wick": { "name": "Wick", "line": "New to the Guild. Cheap, and mostly what they say they are." },
    "lamp": { "name": "Lamp", "line": "A few seasons on the road and still alive, which says something." },
    "lantern": { "name": "Lantern", "line": "Known in more than one town. Keeps one trick back until they trust you." },
    "beacon": { "name": "Beacon", "line": "A name the Vale would know. Rare, dear, and worth it." },
    "found": { "name": "Companion", "line": "Not the Guild's. Takes no wage." }
  },
  "families": {
    "stat": "Self",
    "fight": "Fighting",
    "skill": "Ability",
    "aura": "Party aura",
    "bond": "Bond",
    "gold": "Gold",
    "quirk": "Quirk"
  },
  "perks": {
    "stubborn": { "name": "Stubborn", "text": "+10 % DEF." },
    "hardy": { "name": "Hardy", "text": "+10 % max HP." },
    "keen_eyed": { "name": "Keen-eyed", "text": "+3 % CRIT." },
    "light_footed": { "name": "Light-footed", "text": "+3 % DODGE." },
    "iron_lunged": { "name": "Iron-lunged", "text": "+25 % HP regen." },
    "devout": { "name": "Devout", "text": "Their heals are 10 % stronger." },
    "bodyguard": { "name": "Bodyguard", "text": "Within 3 tiles of you, takes a fifth of every blow aimed at you." },
    "skirmisher": { "name": "Skirmisher", "text": "+20 % damage to a foe that's fighting someone else." },
    "finisher": { "name": "Finisher", "text": "+15 % damage to a foe under half its health." },
    "last_stand": { "name": "Last Stand", "text": "+20 % damage while under a quarter of their health." },
    "field_medic": { "name": "Field Medic", "text": "Every 12 s in a fight, patches up the most hurt of you for 5 % of their max HP." },
    "grave_warden": { "name": "Grave-warden", "text": "+15 % damage to the Ashbound." },
    "redhand_breaker": { "name": "Redhand-breaker", "text": "+15 % damage to the living." },
    "venomous": { "name": "Venomous", "text": "Venom lasts 2 s longer." },
    "smoke_artist": { "name": "Smoke Artist", "text": "Smoke Step lasts 2 s longer." },
    "long_watch": { "name": "Long Watch", "text": "Shield Wall lasts 2 s longer." },
    "kindler": { "name": "Kindler", "text": "Firebolt also burns those beside its target, for 0.3×." },
    "steady_hands": { "name": "Steady Hands", "text": "Mend heals 15 % more." },
    "drillmaster": { "name": "Drillmaster", "text": "Party aura: everyone attacks 5 % faster." },
    "banner_man": { "name": "Banner-man", "text": "Party aura: everyone +5 % DEF." },
    "old_campaigner": { "name": "Old Campaigner", "text": "Party aura: everyone regains HP 10 % faster in a fight." },
    "hometown": { "name": "Hometown", "text": "+8 % DEF if you're Thornwick-born." },
    "deserters_bond": { "name": "Deserter's Bond", "text": "+10 % ATK if you left the Redhand too." },
    "sisters_ward": { "name": "Sister's Ward", "text": "Their heals are 15 % stronger if you were a Grey Sisters' ward." },
    "delvers_eyes": { "name": "Delver's Eyes", "text": "+10 % ATK on a site's second floor and deeper, if you were Deepdelver-fostered." },
    "shield_brother": { "name": "Shield-brother", "text": "+10 % DEF while another fighter is in the party." },
    "thrifty": { "name": "Thrifty", "text": "Their wage is 30 % lower." },
    "haggler": { "name": "Haggler", "text": "The inn and the temple cost you 15 % less." },
    "scavenger": { "name": "Scavenger", "text": "Foes drop 10 % more gold." },
    "greedy": { "name": "Greedy", "text": "Wants half again the wage. Foes drop 5 % more gold." },
    "reckless": { "name": "Reckless", "text": "+10 % ATK, −10 % DEF." },
    "drinker": { "name": "Drinker", "text": "−5 % ATK unless you've slept at an inn in the last two days." }
  },
  "terms": {
    "title": "The Guild's terms",
    "intro": "Pinned by the board in a careful hand. The Lantern Guild hires out its own: a fee to sign one on, then a wage at every dawn.",
    "sections": [
      { "head": "Ranks", "text": "Every sellsword carries a Guild rank. The higher the rank, the more they're good at and the more they cost. Fee and wage are times their level." },
      { "head": "Seasons", "text": "The Guild keeps its seasoned members for companies it knows. Whoever you sign on comes at half your level, rounded up, and learns the rest at your side. Their wage grows with them." },
      { "head": "Wages", "text": "Paid at every dawn, wherever you are: the two with you in full, the bench at half. Each one is paid in full or not at all, the party first." },
      { "head": "Owed", "text": "A sellsword you can't pay is owed. They still fight, but their perks go dark until you settle up at a tavern, or until a dawn you can pay it all. Each unpaid dawn costs you their loyalty." },
      { "head": "Loyalty", "text": "Loyalty grows a step for every dawn they're paid in your party, and for every boss you put down together. At loyalty 3 a Lantern or Beacon shows the perk they kept back. At loyalty 5 they're Sworn: a quarter off their wage, and once a room they get up from the blow that would have Downed them." },
      { "head": "Ask around", "text": "New faces at the tavern, for 10 gold a level. It doubles each time you ask on the same day. A new day brings new faces anyway." },
      { "head": "Retrain", "text": "A Guild drillmaster swaps one perk for another of its kind that costs no more, for 60 gold a level, more each time. A quirk is who they are: no training takes it out." }
    ],
    "families": {
      "stat": "Their own stats.",
      "fight": "How they fight, and who against.",
      "skill": "A tweak to one of their class's abilities.",
      "aura": "The whole party. Only the strongest of a kind counts.",
      "bond": "Stronger alongside the right hero or company.",
      "gold": "Wages, prices, and what foes drop.",
      "quirk": "A cost, for one more perk point."
    },
    "found": "Companions you find, like Brannoc, aren't the Guild's. They take no fee and no wage, and come with perks of their own."
  }
}
